{
	"$schema": "https://pi.dev/schemas/theme.schema.json",
	"name": "gruvbox-light",
	"appearance": "light",
	"vars": {
		"text": "#3c3836",
		"muted": "#625851",
		"dim": "#766a5f",
		"comment": "#85786b",
		"red": "#9d0006",
		"orange": "#af3a03",
		"yellow": "#7f5a23",
		"green": "#67621a",
		"cyan": "#406a50",
		"blue": "#076678",
		"violet": "#8f3f71",
		"pink": "#8f3f71",
		"bg": "#fbf1c7",
		"panel": "#f2e5bc",
		"sel": "#ebdbb2"
	},
	"colors": {
		"accent": "yellow",
		"border": "blue",
		"borderAccent": "yellow",
		"borderMuted": "dim",
		"success": "green",
		"error": "red",
		"warning": "yellow",
		"muted": "muted",
		"dim": "dim",
		"text": "text",
		"thinkingText": "muted",
		"selectedBg": "sel",
		"scrollbarTrack": "sel",
		"scrollbarThumb": "dim",
		"searchMatchBg": "#e6cf9b",
		"searchMatchText": "text",
		"userMessageBg": "sel",
		"userMessageText": "text",
		"customMessageBg": "#ead7a7",
		"customMessageText": "muted",
		"customMessageLabel": "yellow",
		"toolPendingBg": "panel",
		"toolSuccessBg": "#e6daab",
		"toolErrorBg": "#eacfaa",
		"toolTitle": "text",
		"toolOutput": "muted",
		"mdHeading": "yellow",
		"mdLink": "blue",
		"mdLinkUrl": "dim",
		"mdCode": "cyan",
		"mdCodeBlock": "green",
		"mdCodeBlockBorder": "dim",
		"mdQuote": "muted",
		"mdQuoteBorder": "dim",
		"mdHr": "dim",
		"mdListBullet": "yellow",
		"toolDiffAdded": "green",
		"toolDiffRemoved": "red",
		"toolDiffContext": "muted",
		"syntaxComment": "#6b6158",
		"syntaxKeyword": "violet",
		"syntaxFunction": "blue",
		"syntaxVariable": "text",
		"syntaxString": "green",
		"syntaxNumber": "orange",
		"syntaxType": "yellow",
		"syntaxOperator": "cyan",
		"syntaxPunctuation": "muted",
		"thinkingOff": "comment",
		"thinkingMinimal": "dim",
		"thinkingLow": "blue",
		"thinkingMedium": "cyan",
		"thinkingHigh": "violet",
		"thinkingXhigh": "pink",
		"thinkingMax": "orange",
		"bashMode": "green"
	},
	"export": {
		"pageBg": "#fbf1c7",
		"cardBg": "#f2e5bc",
		"infoBg": "#dbc99d"
	}
}
