{
	"$schema": "https://pi.dev/schemas/theme.schema.json",
	"name": "solarized-light",
	"appearance": "light",
	"vars": {
		"text": "#354246",
		"muted": "#4d5e64",
		"dim": "#606f72",
		"comment": "#728081",
		"red": "#b23635",
		"orange": "#9e4824",
		"yellow": "#6f6226",
		"green": "#596926",
		"cyan": "#306d6b",
		"blue": "#2e668c",
		"violet": "#596198",
		"pink": "#ac3973",
		"bg": "#fdf6e3",
		"panel": "#eee8d5",
		"sel": "#e4ddc8"
	},
	"colors": {
		"accent": "blue",
		"border": "blue",
		"borderAccent": "blue",
		"borderMuted": "dim",
		"success": "green",
		"error": "red",
		"warning": "yellow",
		"muted": "muted",
		"dim": "dim",
		"text": "text",
		"thinkingText": "muted",
		"selectedBg": "sel",
		"scrollbarTrack": "sel",
		"scrollbarThumb": "dim",
		"searchMatchBg": "#e3d5ab",
		"searchMatchText": "text",
		"userMessageBg": "sel",
		"userMessageText": "text",
		"customMessageBg": "#d5dcd5",
		"customMessageText": "muted",
		"customMessageLabel": "blue",
		"toolPendingBg": "panel",
		"toolSuccessBg": "#e4e0c0",
		"toolErrorBg": "#ecd6c5",
		"toolTitle": "text",
		"toolOutput": "muted",
		"mdHeading": "yellow",
		"mdLink": "blue",
		"mdLinkUrl": "dim",
		"mdCode": "cyan",
		"mdCodeBlock": "green",
		"mdCodeBlockBorder": "dim",
		"mdQuote": "muted",
		"mdQuoteBorder": "dim",
		"mdHr": "dim",
		"mdListBullet": "blue",
		"toolDiffAdded": "green",
		"toolDiffRemoved": "red",
		"toolDiffContext": "muted",
		"syntaxComment": "#5b696b",
		"syntaxKeyword": "violet",
		"syntaxFunction": "blue",
		"syntaxVariable": "text",
		"syntaxString": "green",
		"syntaxNumber": "orange",
		"syntaxType": "yellow",
		"syntaxOperator": "cyan",
		"syntaxPunctuation": "muted",
		"thinkingOff": "comment",
		"thinkingMinimal": "dim",
		"thinkingLow": "blue",
		"thinkingMedium": "cyan",
		"thinkingHigh": "violet",
		"thinkingXhigh": "pink",
		"thinkingMax": "orange",
		"bashMode": "green"
	},
	"export": {
		"pageBg": "#fdf6e3",
		"cardBg": "#eee8d5",
		"infoBg": "#d5cdb2"
	}
}
