{
	"$schema": "https://pi.dev/schemas/theme.schema.json",
	"name": "dracula",
	"appearance": "dark",
	"vars": {
		"text": "#ffffff",
		"muted": "#d3d4df",
		"dim": "#a7abc4",
		"comment": "#8995bb",
		"red": "#ffbbbb",
		"orange": "#ffbc73",
		"yellow": "#f1fa8c",
		"green": "#50fa7b",
		"cyan": "#8be9fd",
		"blue": "#d7befb",
		"violet": "#d7befb",
		"pink": "#ffb5e0",
		"bg": "#282a36",
		"panel": "#21222c",
		"sel": "#44475a"
	},
	"colors": {
		"accent": "violet",
		"border": "blue",
		"borderAccent": "violet",
		"borderMuted": "dim",
		"success": "green",
		"error": "red",
		"warning": "yellow",
		"muted": "muted",
		"dim": "dim",
		"text": "text",
		"thinkingText": "muted",
		"selectedBg": "sel",
		"scrollbarTrack": "sel",
		"scrollbarThumb": "dim",
		"searchMatchBg": "#5b5e47",
		"searchMatchText": "text",
		"userMessageBg": "sel",
		"userMessageText": "text",
		"customMessageBg": "#3d3651",
		"customMessageText": "muted",
		"customMessageLabel": "violet",
		"toolPendingBg": "panel",
		"toolSuccessBg": "#284037",
		"toolErrorBg": "#402932",
		"toolTitle": "text",
		"toolOutput": "muted",
		"mdHeading": "yellow",
		"mdLink": "blue",
		"mdLinkUrl": "dim",
		"mdCode": "cyan",
		"mdCodeBlock": "green",
		"mdCodeBlockBorder": "dim",
		"mdQuote": "muted",
		"mdQuoteBorder": "dim",
		"mdHr": "dim",
		"mdListBullet": "violet",
		"toolDiffAdded": "green",
		"toolDiffRemoved": "red",
		"toolDiffContext": "muted",
		"syntaxComment": "comment",
		"syntaxKeyword": "violet",
		"syntaxFunction": "blue",
		"syntaxVariable": "text",
		"syntaxString": "green",
		"syntaxNumber": "orange",
		"syntaxType": "yellow",
		"syntaxOperator": "cyan",
		"syntaxPunctuation": "muted",
		"thinkingOff": "comment",
		"thinkingMinimal": "dim",
		"thinkingLow": "blue",
		"thinkingMedium": "cyan",
		"thinkingHigh": "violet",
		"thinkingXhigh": "pink",
		"thinkingMax": "orange",
		"bashMode": "green"
	},
	"export": {
		"pageBg": "#282a36",
		"cardBg": "#21222c",
		"infoBg": "#4b4d3f"
	}
}
