{
	"$schema": "https://pi.dev/schemas/theme.schema.json",
	"name": "monokai",
	"appearance": "dark",
	"vars": {
		"text": "#f8f8f2",
		"muted": "#cac7b6",
		"dim": "#aeac9c",
		"comment": "#9c9a8a",
		"red": "#f8a4bf",
		"orange": "#fcaa49",
		"yellow": "#e6db74",
		"green": "#a6e22e",
		"cyan": "#66d9ef",
		"blue": "#66d9ef",
		"violet": "#ccb1fa",
		"pink": "#f8a4bf",
		"bg": "#272822",
		"panel": "#1e1f1c",
		"sel": "#49483e"
	},
	"colors": {
		"accent": "green",
		"border": "blue",
		"borderAccent": "green",
		"borderMuted": "dim",
		"success": "green",
		"error": "red",
		"warning": "yellow",
		"muted": "muted",
		"dim": "dim",
		"text": "text",
		"thinkingText": "muted",
		"selectedBg": "sel",
		"scrollbarTrack": "sel",
		"scrollbarThumb": "dim",
		"searchMatchBg": "#565435",
		"searchMatchText": "text",
		"userMessageBg": "sel",
		"userMessageText": "text",
		"customMessageBg": "#36421f",
		"customMessageText": "muted",
		"customMessageLabel": "green",
		"toolPendingBg": "panel",
		"toolSuccessBg": "#313a1f",
		"toolErrorBg": "#3d2028",
		"toolTitle": "text",
		"toolOutput": "muted",
		"mdHeading": "yellow",
		"mdLink": "blue",
		"mdLinkUrl": "dim",
		"mdCode": "cyan",
		"mdCodeBlock": "green",
		"mdCodeBlockBorder": "dim",
		"mdQuote": "muted",
		"mdQuoteBorder": "dim",
		"mdHr": "dim",
		"mdListBullet": "green",
		"toolDiffAdded": "green",
		"toolDiffRemoved": "red",
		"toolDiffContext": "muted",
		"syntaxComment": "#adac9e",
		"syntaxKeyword": "violet",
		"syntaxFunction": "blue",
		"syntaxVariable": "text",
		"syntaxString": "green",
		"syntaxNumber": "orange",
		"syntaxType": "yellow",
		"syntaxOperator": "cyan",
		"syntaxPunctuation": "muted",
		"thinkingOff": "comment",
		"thinkingMinimal": "dim",
		"thinkingLow": "blue",
		"thinkingMedium": "cyan",
		"thinkingHigh": "violet",
		"thinkingXhigh": "pink",
		"thinkingMax": "orange",
		"bashMode": "green"
	},
	"export": {
		"pageBg": "#272822",
		"cardBg": "#1e1f1c",
		"infoBg": "#46452e"
	}
}
