{
	"$schema": "https://pi.dev/schemas/theme.schema.json",
	"name": "rose-pine",
	"appearance": "dark",
	"vars": {
		"text": "#ecebf8",
		"muted": "#c3c0d5",
		"dim": "#817d97",
		"comment": "#74708c",
		"red": "#eba1bb",
		"orange": "#ebbcba",
		"yellow": "#f6c177",
		"green": "#9ccfd8",
		"cyan": "#9ccfd8",
		"blue": "#a1bbce",
		"violet": "#c6aae8",
		"pink": "#eba1bb",
		"bg": "#191724",
		"panel": "#1f1d2e",
		"sel": "#26233a"
	},
	"colors": {
		"accent": "violet",
		"border": "blue",
		"borderAccent": "violet",
		"borderMuted": "dim",
		"success": "green",
		"error": "red",
		"warning": "yellow",
		"muted": "muted",
		"dim": "dim",
		"text": "text",
		"thinkingText": "muted",
		"selectedBg": "sel",
		"scrollbarTrack": "sel",
		"scrollbarThumb": "dim",
		"searchMatchBg": "#5b4b42",
		"searchMatchText": "text",
		"userMessageBg": "sel",
		"userMessageText": "text",
		"customMessageBg": "#3d364f",
		"customMessageText": "muted",
		"customMessageLabel": "violet",
		"toolPendingBg": "panel",
		"toolSuccessBg": "#303646",
		"toolErrorBg": "#3c283c",
		"toolTitle": "text",
		"toolOutput": "muted",
		"mdHeading": "yellow",
		"mdLink": "blue",
		"mdLinkUrl": "muted",
		"mdCode": "cyan",
		"mdCodeBlock": "green",
		"mdCodeBlockBorder": "muted",
		"mdQuote": "muted",
		"mdQuoteBorder": "dim",
		"mdHr": "dim",
		"mdListBullet": "violet",
		"toolDiffAdded": "green",
		"toolDiffRemoved": "red",
		"toolDiffContext": "muted",
		"syntaxComment": "#9a97af",
		"syntaxKeyword": "violet",
		"syntaxFunction": "blue",
		"syntaxVariable": "text",
		"syntaxString": "green",
		"syntaxNumber": "orange",
		"syntaxType": "yellow",
		"syntaxOperator": "cyan",
		"syntaxPunctuation": "muted",
		"thinkingOff": "comment",
		"thinkingMinimal": "dim",
		"thinkingLow": "blue",
		"thinkingMedium": "cyan",
		"thinkingHigh": "violet",
		"thinkingXhigh": "pink",
		"thinkingMax": "orange",
		"bashMode": "green"
	},
	"export": {
		"pageBg": "#191724",
		"cardBg": "#1f1d2e",
		"infoBg": "#4a3e3d"
	}
}
