{
	"$schema": "https://pi.dev/schemas/theme.schema.json",
	"name": "gruvbox-dark",
	"appearance": "dark",
	"vars": {
		"text": "#ebdbb2",
		"muted": "#a89984",
		"dim": "#928374",
		"comment": "#7c6f64",
		"red": "#fb4934",
		"orange": "#fe8019",
		"yellow": "#fabd2f",
		"green": "#b8bb26",
		"cyan": "#8ec07c",
		"blue": "#83a598",
		"violet": "#d3869b",
		"pink": "#d3869b",
		"bg": "#282828",
		"panel": "#32302f",
		"sel": "#3c3836"
	},
	"colors": {
		"accent": "yellow",
		"border": "blue",
		"borderAccent": "yellow",
		"borderMuted": "dim",
		"success": "green",
		"error": "red",
		"warning": "yellow",
		"muted": "muted",
		"dim": "dim",
		"text": "text",
		"thinkingText": "muted",
		"selectedBg": "sel",
		"scrollbarTrack": "sel",
		"scrollbarThumb": "dim",
		"searchMatchBg": "#78612f",
		"searchMatchText": "text",
		"userMessageBg": "sel",
		"userMessageText": "text",
		"customMessageBg": "#5e4f2f",
		"customMessageText": "muted",
		"customMessageLabel": "yellow",
		"toolPendingBg": "panel",
		"toolSuccessBg": "#4a492d",
		"toolErrorBg": "#563430",
		"toolTitle": "text",
		"toolOutput": "muted",
		"mdHeading": "yellow",
		"mdLink": "blue",
		"mdLinkUrl": "dim",
		"mdCode": "cyan",
		"mdCodeBlock": "green",
		"mdCodeBlockBorder": "dim",
		"mdQuote": "muted",
		"mdQuoteBorder": "dim",
		"mdHr": "dim",
		"mdListBullet": "yellow",
		"toolDiffAdded": "green",
		"toolDiffRemoved": "red",
		"toolDiffContext": "muted",
		"syntaxComment": "comment",
		"syntaxKeyword": "violet",
		"syntaxFunction": "blue",
		"syntaxVariable": "text",
		"syntaxString": "green",
		"syntaxNumber": "orange",
		"syntaxType": "yellow",
		"syntaxOperator": "cyan",
		"syntaxPunctuation": "muted",
		"thinkingOff": "comment",
		"thinkingMinimal": "dim",
		"thinkingLow": "blue",
		"thinkingMedium": "cyan",
		"thinkingHigh": "violet",
		"thinkingXhigh": "pink",
		"thinkingMax": "orange",
		"bashMode": "green"
	},
	"export": {
		"pageBg": "#282828",
		"cardBg": "#32302f",
		"infoBg": "#5a4c2f"
	}
}
