{
	"$schema": "https://pi.dev/schemas/theme.schema.json",
	"name": "catppuccin-macchiato",
	"appearance": "dark",
	"vars": {
		"text": "#cad3f5",
		"muted": "#a5adcb",
		"dim": "#8087a2",
		"comment": "#6e738d",
		"red": "#ed8796",
		"orange": "#f5a97f",
		"yellow": "#eed49f",
		"green": "#a6da95",
		"cyan": "#8bd5ca",
		"blue": "#8aadf4",
		"violet": "#c6a0f6",
		"pink": "#f5bde6",
		"bg": "#24273a",
		"panel": "#1e2030",
		"sel": "#363a4f"
	},
	"colors": {
		"accent": "violet",
		"border": "blue",
		"borderAccent": "violet",
		"borderMuted": "dim",
		"success": "green",
		"error": "red",
		"warning": "yellow",
		"muted": "muted",
		"dim": "dim",
		"text": "text",
		"thinkingText": "muted",
		"selectedBg": "sel",
		"scrollbarTrack": "sel",
		"scrollbarThumb": "dim",
		"searchMatchBg": "#675f57",
		"searchMatchText": "text",
		"userMessageBg": "sel",
		"userMessageText": "text",
		"customMessageBg": "#433c5c",
		"customMessageText": "muted",
		"customMessageLabel": "violet",
		"toolPendingBg": "panel",
		"toolSuccessBg": "#364142",
		"toolErrorBg": "#433342",
		"toolTitle": "text",
		"toolOutput": "muted",
		"mdHeading": "yellow",
		"mdLink": "blue",
		"mdLinkUrl": "dim",
		"mdCode": "cyan",
		"mdCodeBlock": "green",
		"mdCodeBlockBorder": "dim",
		"mdQuote": "muted",
		"mdQuoteBorder": "dim",
		"mdHr": "dim",
		"mdListBullet": "violet",
		"toolDiffAdded": "green",
		"toolDiffRemoved": "red",
		"toolDiffContext": "muted",
		"syntaxComment": "comment",
		"syntaxKeyword": "violet",
		"syntaxFunction": "blue",
		"syntaxVariable": "text",
		"syntaxString": "green",
		"syntaxNumber": "orange",
		"syntaxType": "yellow",
		"syntaxOperator": "cyan",
		"syntaxPunctuation": "muted",
		"thinkingOff": "comment",
		"thinkingMinimal": "dim",
		"thinkingLow": "blue",
		"thinkingMedium": "cyan",
		"thinkingHigh": "violet",
		"thinkingXhigh": "pink",
		"thinkingMax": "orange",
		"bashMode": "green"
	},
	"export": {
		"pageBg": "#24273a",
		"cardBg": "#1e2030",
		"infoBg": "#484446"
	}
}
