{
	"$schema": "https://pi.dev/schemas/theme.schema.json",
	"name": "solarized-dark",
	"appearance": "dark",
	"vars": {
		"text": "#ced5d5",
		"muted": "#9dabac",
		"dim": "#7f9298",
		"comment": "#6a7d83",
		"red": "#d48c8a",
		"orange": "#cc9075",
		"yellow": "#bb9c35",
		"green": "#97a835",
		"cyan": "#53aea7",
		"blue": "#61a5d3",
		"violet": "#989ecc",
		"pink": "#d086ac",
		"bg": "#002b36",
		"panel": "#00252f",
		"sel": "#073642"
	},
	"colors": {
		"accent": "blue",
		"border": "blue",
		"borderAccent": "blue",
		"borderMuted": "dim",
		"success": "green",
		"error": "red",
		"warning": "yellow",
		"muted": "muted",
		"dim": "dim",
		"text": "text",
		"thinkingText": "muted",
		"selectedBg": "sel",
		"scrollbarTrack": "sel",
		"scrollbarThumb": "dim",
		"searchMatchBg": "#334122",
		"searchMatchText": "text",
		"userMessageBg": "sel",
		"userMessageText": "text",
		"customMessageBg": "#07374c",
		"customMessageText": "muted",
		"customMessageLabel": "blue",
		"toolPendingBg": "panel",
		"toolSuccessBg": "#133528",
		"toolErrorBg": "#1f272f",
		"toolTitle": "text",
		"toolOutput": "muted",
		"mdHeading": "yellow",
		"mdLink": "blue",
		"mdLinkUrl": "dim",
		"mdCode": "cyan",
		"mdCodeBlock": "green",
		"mdCodeBlockBorder": "dim",
		"mdQuote": "muted",
		"mdQuoteBorder": "dim",
		"mdHr": "dim",
		"mdListBullet": "blue",
		"toolDiffAdded": "green",
		"toolDiffRemoved": "red",
		"toolDiffContext": "muted",
		"syntaxComment": "#859599",
		"syntaxKeyword": "violet",
		"syntaxFunction": "blue",
		"syntaxVariable": "text",
		"syntaxString": "green",
		"syntaxNumber": "orange",
		"syntaxType": "yellow",
		"syntaxOperator": "cyan",
		"syntaxPunctuation": "muted",
		"thinkingOff": "comment",
		"thinkingMinimal": "dim",
		"thinkingLow": "blue",
		"thinkingMedium": "cyan",
		"thinkingHigh": "violet",
		"thinkingXhigh": "pink",
		"thinkingMax": "orange",
		"bashMode": "green"
	},
	"export": {
		"pageBg": "#002b36",
		"cardBg": "#00252f",
		"infoBg": "#253d30"
	}
}
