{
	"$schema": "https://pi.dev/schemas/theme.schema.json",
	"name": "one-dark",
	"appearance": "dark",
	"vars": {
		"text": "#f2f3f5",
		"muted": "#c0c3cb",
		"dim": "#a1a6af",
		"comment": "#90959f",
		"red": "#e8a9af",
		"orange": "#dbb591",
		"yellow": "#e5c07b",
		"green": "#9cc57f",
		"cyan": "#7dc5cf",
		"blue": "#85c0f0",
		"violet": "#d8a9e7",
		"pink": "#d8a9e7",
		"bg": "#282c34",
		"panel": "#21252b",
		"sel": "#3e4451"
	},
	"colors": {
		"accent": "blue",
		"border": "blue",
		"borderAccent": "blue",
		"borderMuted": "dim",
		"success": "green",
		"error": "red",
		"warning": "yellow",
		"muted": "muted",
		"dim": "dim",
		"text": "text",
		"thinkingText": "muted",
		"selectedBg": "sel",
		"scrollbarTrack": "sel",
		"scrollbarThumb": "dim",
		"searchMatchBg": "#585041",
		"searchMatchText": "text",
		"userMessageBg": "sel",
		"userMessageText": "text",
		"customMessageBg": "#2d3e4e",
		"customMessageText": "muted",
		"customMessageLabel": "blue",
		"toolPendingBg": "panel",
		"toolSuccessBg": "#323b36",
		"toolErrorBg": "#3c2f35",
		"toolTitle": "text",
		"toolOutput": "muted",
		"mdHeading": "yellow",
		"mdLink": "blue",
		"mdLinkUrl": "muted",
		"mdCode": "cyan",
		"mdCodeBlock": "green",
		"mdCodeBlockBorder": "muted",
		"mdQuote": "muted",
		"mdQuoteBorder": "dim",
		"mdHr": "dim",
		"mdListBullet": "blue",
		"toolDiffAdded": "green",
		"toolDiffRemoved": "red",
		"toolDiffContext": "muted",
		"syntaxComment": "#a3a7af",
		"syntaxKeyword": "violet",
		"syntaxFunction": "blue",
		"syntaxVariable": "text",
		"syntaxString": "green",
		"syntaxNumber": "orange",
		"syntaxType": "yellow",
		"syntaxOperator": "cyan",
		"syntaxPunctuation": "muted",
		"thinkingOff": "comment",
		"thinkingMinimal": "dim",
		"thinkingLow": "blue",
		"thinkingMedium": "cyan",
		"thinkingHigh": "violet",
		"thinkingXhigh": "pink",
		"thinkingMax": "orange",
		"bashMode": "green"
	},
	"export": {
		"pageBg": "#282c34",
		"cardBg": "#21252b",
		"infoBg": "#48443b"
	}
}
