{
	"$schema": "https://pi.dev/schemas/theme.schema.json",
	"name": "catppuccin-frappe",
	"appearance": "dark",
	"vars": {
		"text": "#ffffff",
		"muted": "#ced2e4",
		"dim": "#a2a8bd",
		"comment": "#8f94a9",
		"red": "#f2babb",
		"orange": "#f3b798",
		"yellow": "#e5c890",
		"green": "#a6d189",
		"cyan": "#94d0c8",
		"blue": "#b4c8f4",
		"violet": "#dabbee",
		"pink": "#f4b8e4",
		"bg": "#303446",
		"panel": "#292c3c",
		"sel": "#414559"
	},
	"colors": {
		"accent": "violet",
		"border": "blue",
		"borderAccent": "violet",
		"borderMuted": "dim",
		"success": "green",
		"error": "red",
		"warning": "yellow",
		"muted": "muted",
		"dim": "dim",
		"text": "text",
		"thinkingText": "muted",
		"selectedBg": "sel",
		"scrollbarTrack": "sel",
		"scrollbarThumb": "dim",
		"searchMatchBg": "#5e5854",
		"searchMatchText": "text",
		"userMessageBg": "sel",
		"userMessageText": "text",
		"customMessageBg": "#46415b",
		"customMessageText": "muted",
		"customMessageLabel": "violet",
		"toolPendingBg": "panel",
		"toolSuccessBg": "#3a4347",
		"toolErrorBg": "#443846",
		"toolTitle": "text",
		"toolOutput": "muted",
		"mdHeading": "yellow",
		"mdLink": "blue",
		"mdLinkUrl": "muted",
		"mdCode": "cyan",
		"mdCodeBlock": "green",
		"mdCodeBlockBorder": "muted",
		"mdQuote": "muted",
		"mdQuoteBorder": "dim",
		"mdHr": "dim",
		"mdListBullet": "violet",
		"toolDiffAdded": "green",
		"toolDiffRemoved": "red",
		"toolDiffContext": "muted",
		"syntaxComment": "#a5a9ba",
		"syntaxKeyword": "violet",
		"syntaxFunction": "blue",
		"syntaxVariable": "text",
		"syntaxString": "green",
		"syntaxNumber": "orange",
		"syntaxType": "yellow",
		"syntaxOperator": "cyan",
		"syntaxPunctuation": "muted",
		"thinkingOff": "comment",
		"thinkingMinimal": "dim",
		"thinkingLow": "blue",
		"thinkingMedium": "cyan",
		"thinkingHigh": "violet",
		"thinkingXhigh": "pink",
		"thinkingMax": "orange",
		"bashMode": "green"
	},
	"export": {
		"pageBg": "#303446",
		"cardBg": "#292c3c",
		"infoBg": "#4f4b4d"
	}
}
