{
	"$schema": "https://pi.dev/schemas/theme.schema.json",
	"name": "catppuccin-mocha",
	"appearance": "dark",
	"vars": {
		"text": "#f0f3fc",
		"muted": "#c0c6da",
		"dim": "#8a8fa6",
		"comment": "#797d92",
		"red": "#f2a5bd",
		"orange": "#fab387",
		"yellow": "#f9e2af",
		"green": "#a6e3a1",
		"cyan": "#94e2d5",
		"blue": "#98bdfa",
		"violet": "#cfaef8",
		"pink": "#f5c2e7",
		"bg": "#1e1e2e",
		"panel": "#181825",
		"sel": "#313244"
	},
	"colors": {
		"accent": "violet",
		"border": "blue",
		"borderAccent": "violet",
		"borderMuted": "dim",
		"success": "green",
		"error": "red",
		"warning": "yellow",
		"muted": "muted",
		"dim": "dim",
		"text": "text",
		"thinkingText": "muted",
		"selectedBg": "sel",
		"scrollbarTrack": "sel",
		"scrollbarThumb": "dim",
		"searchMatchBg": "#57514c",
		"searchMatchText": "text",
		"userMessageBg": "sel",
		"userMessageText": "text",
		"customMessageBg": "#38324b",
		"customMessageText": "muted",
		"customMessageLabel": "violet",
		"toolPendingBg": "panel",
		"toolSuccessBg": "#2c3436",
		"toolErrorBg": "#372837",
		"toolTitle": "text",
		"toolOutput": "muted",
		"mdHeading": "yellow",
		"mdLink": "blue",
		"mdLinkUrl": "dim",
		"mdCode": "cyan",
		"mdCodeBlock": "green",
		"mdCodeBlockBorder": "dim",
		"mdQuote": "muted",
		"mdQuoteBorder": "dim",
		"mdHr": "dim",
		"mdListBullet": "violet",
		"toolDiffAdded": "green",
		"toolDiffRemoved": "red",
		"toolDiffContext": "muted",
		"syntaxComment": "comment",
		"syntaxKeyword": "violet",
		"syntaxFunction": "blue",
		"syntaxVariable": "text",
		"syntaxString": "green",
		"syntaxNumber": "orange",
		"syntaxType": "yellow",
		"syntaxOperator": "cyan",
		"syntaxPunctuation": "muted",
		"thinkingOff": "comment",
		"thinkingMinimal": "dim",
		"thinkingLow": "blue",
		"thinkingMedium": "cyan",
		"thinkingHigh": "violet",
		"thinkingXhigh": "pink",
		"thinkingMax": "orange",
		"bashMode": "green"
	},
	"export": {
		"pageBg": "#1e1e2e",
		"cardBg": "#181825",
		"infoBg": "#454041"
	}
}
