{
	"$schema": "https://pi.dev/schemas/theme.schema.json",
	"name": "nord",
	"appearance": "dark",
	"vars": {
		"text": "#ffffff",
		"muted": "#ccd2dd",
		"dim": "#97a1b3",
		"comment": "#8892a6",
		"red": "#e5c0c3",
		"orange": "#e8c3b8",
		"yellow": "#ebcb8b",
		"green": "#bacea9",
		"cyan": "#a6d0dc",
		"blue": "#bacbdd",
		"violet": "#d6c1d2",
		"pink": "#d6c1d2",
		"bg": "#2e3440",
		"panel": "#292e39",
		"sel": "#3b4252"
	},
	"colors": {
		"accent": "cyan",
		"border": "blue",
		"borderAccent": "cyan",
		"borderMuted": "dim",
		"success": "green",
		"error": "red",
		"warning": "yellow",
		"muted": "muted",
		"dim": "dim",
		"text": "text",
		"thinkingText": "muted",
		"selectedBg": "sel",
		"scrollbarTrack": "sel",
		"scrollbarThumb": "dim",
		"searchMatchBg": "#5f5a50",
		"searchMatchText": "text",
		"userMessageBg": "sel",
		"userMessageText": "text",
		"customMessageBg": "#3a4854",
		"customMessageText": "muted",
		"customMessageLabel": "cyan",
		"toolPendingBg": "panel",
		"toolSuccessBg": "#3a4245",
		"toolErrorBg": "#3e3540",
		"toolTitle": "text",
		"toolOutput": "muted",
		"mdHeading": "yellow",
		"mdLink": "blue",
		"mdLinkUrl": "dim",
		"mdCode": "cyan",
		"mdCodeBlock": "green",
		"mdCodeBlockBorder": "dim",
		"mdQuote": "muted",
		"mdQuoteBorder": "dim",
		"mdHr": "dim",
		"mdListBullet": "cyan",
		"toolDiffAdded": "green",
		"toolDiffRemoved": "red",
		"toolDiffContext": "muted",
		"syntaxComment": "#a2aaba",
		"syntaxKeyword": "violet",
		"syntaxFunction": "blue",
		"syntaxVariable": "text",
		"syntaxString": "green",
		"syntaxNumber": "orange",
		"syntaxType": "yellow",
		"syntaxOperator": "cyan",
		"syntaxPunctuation": "muted",
		"thinkingOff": "comment",
		"thinkingMinimal": "dim",
		"thinkingLow": "blue",
		"thinkingMedium": "cyan",
		"thinkingHigh": "violet",
		"thinkingXhigh": "pink",
		"thinkingMax": "orange",
		"bashMode": "green"
	},
	"export": {
		"pageBg": "#2e3440",
		"cardBg": "#292e39",
		"infoBg": "#504d49"
	}
}
