{
	"$schema": "https://pi.dev/schemas/theme.schema.json",
	"name": "tokyo-night-storm",
	"appearance": "dark",
	"vars": {
		"text": "#e6eafb",
		"muted": "#b5bcdd",
		"dim": "#8a90b4",
		"comment": "#7a82a6",
		"red": "#f299af",
		"orange": "#ff9e64",
		"yellow": "#e0af68",
		"green": "#9ece6a",
		"cyan": "#7dcfff",
		"blue": "#95b4f8",
		"violet": "#c1a6f8",
		"pink": "#ef98cf",
		"bg": "#24283b",
		"panel": "#1f2335",
		"sel": "#2f334d"
	},
	"colors": {
		"accent": "blue",
		"border": "blue",
		"borderAccent": "blue",
		"borderMuted": "dim",
		"success": "green",
		"error": "red",
		"warning": "yellow",
		"muted": "muted",
		"dim": "dim",
		"text": "text",
		"thinkingText": "muted",
		"selectedBg": "sel",
		"scrollbarTrack": "sel",
		"scrollbarThumb": "dim",
		"searchMatchBg": "#554a43",
		"searchMatchText": "text",
		"userMessageBg": "sel",
		"userMessageText": "text",
		"customMessageBg": "#2f3a58",
		"customMessageText": "muted",
		"customMessageLabel": "blue",
		"toolPendingBg": "panel",
		"toolSuccessBg": "#313b3c",
		"toolErrorBg": "#3d2f41",
		"toolTitle": "text",
		"toolOutput": "muted",
		"mdHeading": "yellow",
		"mdLink": "blue",
		"mdLinkUrl": "dim",
		"mdCode": "cyan",
		"mdCodeBlock": "green",
		"mdCodeBlockBorder": "dim",
		"mdQuote": "muted",
		"mdQuoteBorder": "dim",
		"mdHr": "dim",
		"mdListBullet": "blue",
		"toolDiffAdded": "green",
		"toolDiffRemoved": "red",
		"toolDiffContext": "muted",
		"syntaxComment": "#939aba",
		"syntaxKeyword": "violet",
		"syntaxFunction": "blue",
		"syntaxVariable": "text",
		"syntaxString": "green",
		"syntaxNumber": "orange",
		"syntaxType": "yellow",
		"syntaxOperator": "cyan",
		"syntaxPunctuation": "muted",
		"thinkingOff": "comment",
		"thinkingMinimal": "dim",
		"thinkingLow": "blue",
		"thinkingMedium": "cyan",
		"thinkingHigh": "violet",
		"thinkingXhigh": "pink",
		"thinkingMax": "orange",
		"bashMode": "green"
	},
	"export": {
		"pageBg": "#24283b",
		"cardBg": "#1f2335",
		"infoBg": "#463f3f"
	}
}
