{
	"$schema": "https://pi.dev/schemas/theme.schema.json",
	"name": "catppuccin-latte",
	"appearance": "light",
	"vars": {
		"text": "#393b4f",
		"muted": "#55586d",
		"dim": "#5e6174",
		"comment": "#6f7384",
		"red": "#bb163c",
		"orange": "#924d30",
		"yellow": "#73583e",
		"green": "#3c683f",
		"cyan": "#286674",
		"blue": "#2659c3",
		"violet": "#7839cf",
		"pink": "#77507a",
		"bg": "#eff1f5",
		"panel": "#e6e9ef",
		"sel": "#ccd0da"
	},
	"colors": {
		"accent": "violet",
		"border": "blue",
		"borderAccent": "violet",
		"borderMuted": "dim",
		"success": "green",
		"error": "red",
		"warning": "yellow",
		"muted": "muted",
		"dim": "dim",
		"text": "text",
		"thinkingText": "muted",
		"selectedBg": "sel",
		"scrollbarTrack": "sel",
		"scrollbarThumb": "dim",
		"searchMatchBg": "#e5d7c6",
		"searchMatchText": "text",
		"userMessageBg": "sel",
		"userMessageText": "text",
		"customMessageBg": "#dad3ef",
		"customMessageText": "muted",
		"customMessageLabel": "violet",
		"toolPendingBg": "panel",
		"toolSuccessBg": "#d6e2dc",
		"toolErrorBg": "#e4d4dd",
		"toolTitle": "text",
		"toolOutput": "muted",
		"mdHeading": "yellow",
		"mdLink": "blue",
		"mdLinkUrl": "dim",
		"mdCode": "cyan",
		"mdCodeBlock": "green",
		"mdCodeBlockBorder": "dim",
		"mdQuote": "muted",
		"mdQuoteBorder": "dim",
		"mdHr": "dim",
		"mdListBullet": "violet",
		"toolDiffAdded": "green",
		"toolDiffRemoved": "red",
		"toolDiffContext": "muted",
		"syntaxComment": "#5d6072",
		"syntaxKeyword": "violet",
		"syntaxFunction": "blue",
		"syntaxVariable": "text",
		"syntaxString": "green",
		"syntaxNumber": "orange",
		"syntaxType": "yellow",
		"syntaxOperator": "cyan",
		"syntaxPunctuation": "muted",
		"thinkingOff": "comment",
		"thinkingMinimal": "dim",
		"thinkingLow": "blue",
		"thinkingMedium": "cyan",
		"thinkingHigh": "violet",
		"thinkingXhigh": "pink",
		"thinkingMax": "orange",
		"bashMode": "green"
	},
	"export": {
		"pageBg": "#eff1f5",
		"cardBg": "#e6e9ef",
		"infoBg": "#cfcccc"
	}
}
