{
	"$schema": "https://pi.dev/schemas/theme.schema.json",
	"name": "tokyo-night-day",
	"appearance": "light",
	"vars": {
		"text": "#3760bf",
		"muted": "#3760bf",
		"dim": "#4e6dbc",
		"comment": "#6d7fb8",
		"red": "#bc3a80",
		"orange": "#9f5d1d",
		"yellow": "#7b6a58",
		"green": "#587539",
		"cyan": "#007197",
		"blue": "#3469cc",
		"violet": "#685ad8",
		"pink": "#d20065",
		"bg": "#e1e2e7",
		"panel": "#d0d5e3",
		"sel": "#c4c8da"
	},
	"colors": {
		"accent": "blue",
		"border": "blue",
		"borderAccent": "blue",
		"borderMuted": "dim",
		"success": "green",
		"error": "red",
		"warning": "yellow",
		"muted": "muted",
		"dim": "dim",
		"text": "text",
		"thinkingText": "muted",
		"selectedBg": "sel",
		"scrollbarTrack": "sel",
		"scrollbarThumb": "dim",
		"searchMatchBg": "#b2b0b2",
		"searchMatchText": "text",
		"userMessageBg": "sel",
		"userMessageText": "text",
		"customMessageBg": "#a7b9dd",
		"customMessageText": "muted",
		"customMessageLabel": "blue",
		"toolPendingBg": "panel",
		"toolSuccessBg": "#b6c0be",
		"toolErrorBg": "#ccb3cd",
		"toolTitle": "text",
		"toolOutput": "muted",
		"mdHeading": "yellow",
		"mdLink": "blue",
		"mdLinkUrl": "dim",
		"mdCode": "cyan",
		"mdCodeBlock": "green",
		"mdCodeBlockBorder": "dim",
		"mdQuote": "muted",
		"mdQuoteBorder": "dim",
		"mdHr": "dim",
		"mdListBullet": "blue",
		"toolDiffAdded": "green",
		"toolDiffRemoved": "red",
		"toolDiffContext": "muted",
		"syntaxComment": "comment",
		"syntaxKeyword": "violet",
		"syntaxFunction": "blue",
		"syntaxVariable": "text",
		"syntaxString": "green",
		"syntaxNumber": "orange",
		"syntaxType": "yellow",
		"syntaxOperator": "cyan",
		"syntaxPunctuation": "muted",
		"thinkingOff": "comment",
		"thinkingMinimal": "dim",
		"thinkingLow": "blue",
		"thinkingMedium": "cyan",
		"thinkingHigh": "violet",
		"thinkingXhigh": "pink",
		"thinkingMax": "orange",
		"bashMode": "green"
	},
	"export": {
		"pageBg": "#e1e2e7",
		"cardBg": "#d0d5e3",
		"infoBg": "#bfc0c7"
	}
}
